{
  "schema": "film.film-treatment@1",
  "id": "quiet-cinema",
  "revision": 1,
  "projectId": "sando",
  "recipe": {
    "id": "system.quiet-cinema",
    "revision": "r1",
    "digest": "sha256:d96cdece80985b7a05fd75ba7b7200d2746dc8f39515875dd8123a76e0a0db63"
  },
  "storyGraph": {
    "id": "sando-walk",
    "revision": 1
  },
  "shared": {
    "worldview": "A quiet walk toward a shrine, told without explanation.",
    "bgm": {
      "asset": "sounds/bgm-96bpm.wav",
      "sha256": "sha256:b7e26af8ffc086fc59ef6b1f2a83d674b051958bcecf2b951408f9863f5d1443",
      "gain": 0.8
    },
    "typography": {
      "id": "font.noto-serif-jp",
      "version": "1.0.0",
      "digest": "sha256:e1fbbd028eca1fe001795e46ad03120433c5e083be31a87a23fa6173b855e8e6"
    },
    "colorFamily": "warm-film",
    "outputProfile": "landscape-1080p30@1"
  },
  "overallTitle": "参道 / Sando",
  "projectFonts": [],
  "chapters": [
    {
      "chapterId": "c1",
      "settings": {
        "motionAmount": 0.35,
        "visualIntensity": 0.4
      }
    },
    {
      "chapterId": "c2",
      "settings": {
        "motionAmount": 0.55,
        "visualIntensity": 0.65
      }
    }
  ]
}
